{
  "schema_version": 1,
  "dataset": "netlist",
  "generated_at": "2026-10-30T09:01:45+00:00",
  "notice": "Кандидаты для проверки: наличие домена в списке не подтверждает блокировку, доступность или принадлежность IP сервису.",
  "counts": {
    "services": 273,
    "categories": 27,
    "domains": 563
  },
  "categories": [
    {
      "id": "adult_18",
      "services_count": 8,
      "domains_count": 8
    },
    {
      "id": "ai",
      "services_count": 12,
      "domains_count": 36
    },
    {
      "id": "banks_payments",
      "services_count": 11,
      "domains_count": 13
    },
    {
      "id": "cloud_cdn",
      "services_count": 14,
      "domains_count": 20
    },
    {
      "id": "developer_tools",
      "services_count": 13,
      "domains_count": 20
    },
    {
      "id": "file_sharing",
      "services_count": 11,
      "domains_count": 72
    },
    {
      "id": "finance_marketplaces",
      "services_count": 14,
      "domains_count": 17
    },
    {
      "id": "gambling",
      "services_count": 8,
      "domains_count": 8
    },
    {
      "id": "gaming",
      "services_count": 14,
      "domains_count": 20
    },
    {
      "id": "government",
      "services_count": 11,
      "domains_count": 11
    },
    {
      "id": "health_sport",
      "services_count": 6,
      "domains_count": 6
    },
    {
      "id": "it_business_education",
      "services_count": 19,
      "domains_count": 34
    },
    {
      "id": "mail",
      "services_count": 8,
      "domains_count": 13
    },
    {
      "id": "marketplaces_delivery",
      "services_count": 12,
      "domains_count": 17
    },
    {
      "id": "messengers",
      "services_count": 8,
      "domains_count": 33
    },
    {
      "id": "messengers_telecom",
      "services_count": 8,
      "domains_count": 10
    },
    {
      "id": "movies",
      "services_count": 10,
      "domains_count": 12
    },
    {
      "id": "music",
      "services_count": 12,
      "domains_count": 13
    },
    {
      "id": "news_education",
      "services_count": 13,
      "domains_count": 14
    },
    {
      "id": "os_security",
      "services_count": 11,
      "domains_count": 93
    },
    {
      "id": "search_ecosystems",
      "services_count": 7,
      "domains_count": 16
    },
    {
      "id": "search_portals",
      "services_count": 9,
      "domains_count": 52
    },
    {
      "id": "social",
      "services_count": 13,
      "domains_count": 17
    },
    {
      "id": "torrents_p2p",
      "services_count": 10,
      "domains_count": 10
    },
    {
      "id": "transport",
      "services_count": 9,
      "domains_count": 9
    },
    {
      "id": "video_music_media",
      "services_count": 15,
      "domains_count": 15
    },
    {
      "id": "video_streaming",
      "services_count": 12,
      "domains_count": 15
    }
  ],
  "services": [
    {
      "name": "1337x",
      "slug": "1337x",
      "primary_domain": "1337x.to",
      "domains": [
        "1337x.to"
      ],
      "domain_count": 1,
      "categories": [
        "torrents_p2p"
      ],
      "datasets": [
        "global"
      ],
      "seed_status": "candidate_unverified"
    },
    {
      "name": "1С",
      "slug": "1c",
      "primary_domain": "1c.ru",
      "domains": [
        "1c.ru"
      ],
      "domain_count": 1,
      "categories": [
        "it_business_education"
      ],
      "datasets": [
        "russian"
      ],
      "seed_status": "candidate_unverified"
    },
    {
      "name": "1xBet",
      "slug": "1xbet",
      "primary_domain": "1xbet.com",
      "domains": [
        "1xbet.com"
      ],
      "domain_count": 1,
      "categories": [
        "gambling"
      ],
      "datasets": [
        "global"
      ],
      "seed_status": "candidate_unverified"
    },
    {
      "name": "2ГИС",
      "slug": "2gis",
      "primary_domain": "2gis.ru",
      "domains": [
        "2gis.ru"
      ],
      "domain_count": 1,
      "categories": [
        "search_ecosystems",
        "transport"
      ],
      "datasets": [
        "russian"
      ],
      "seed_status": "candidate_unverified"
    },
    {
      "name": "Аэрофлот",
      "slug": "aeroflot",
      "primary_domain": "aeroflot.ru",
      "domains": [
        "aeroflot.ru"
      ],
      "domain_count": 1,
      "categories": [
        "transport"
      ],
      "datasets": [
        "russian"
      ],
      "seed_status": "candidate_unverified"
    },
    {
      "name": "АиФ",
      "slug": "aif",
      "primary_domain": "aif.ru",
      "domains": [
        "aif.ru"
      ],
      "domain_count": 1,
      "categories": [
        "video_music_media"
      ],
      "datasets": [
        "russian"
      ],
      "seed_status": "candidate_unverified"
    },
    {
      "name": "Akamai",
      "slug": "akamai",
      "primary_domain": "akamai.com",
      "domains": [
        "akamai.com"
      ],
      "domain_count": 1,
      "categories": [
        "cloud_cdn"
      ],
      "datasets": [
        "global"
      ],
      "seed_status": "candidate_unverified"
    },
    {
      "name": "Альфа-Банк",
      "slug": "alfa-bank",
      "primary_domain": "alfabank.ru",
      "domains": [
        "alfabank.ru"
      ],
      "domain_count": 1,
      "categories": [
        "banks_payments"
      ],
      "datasets": [
        "russian"
      ],
      "seed_status": "candidate_unverified"
    },
    {
      "name": "AliExpress",
      "slug": "aliexpress",
      "primary_domain": "aliexpress.com",
      "domains": [
        "aliexpress.com"
      ],
      "domain_count": 1,
      "categories": [
        "finance_marketplaces"
      ],
      "datasets": [
        "global"
      ],
      "seed_status": "candidate_unverified"
    },
    {
      "name": "Amazon",
      "slug": "amazon",
      "primary_domain": "amazon.com",
      "domains": [
        "amazon.com"
      ],
      "domain_count": 1,
      "categories": [
        "finance_marketplaces"
      ],
      "datasets": [
        "global"
      ],
      "seed_status": "candidate_unverified"
    },
    {
      "name": "Amazon Music",
      "slug": "amazon-music",
      "primary_domain": "music.amazon.com",
      "domains": [
        "music.amazon.com"
      ],
      "domain_count": 1,
      "categories": [
        "music"
      ],
      "datasets": [
        "global"
      ],
      "seed_status": "candidate_unverified"
    },
    {
      "name": "Android",
      "slug": "android",
      "primary_domain": "android.com",
      "domains": [
        "android.com",
        "android.googleapis.com"
      ],
      "domain_count": 2,
      "categories": [
        "os_security"
      ],
      "datasets": [
        "global"
      ],
      "seed_status": "candidate_unverified"
    },
    {
      "name": "AP News",
      "slug": "ap-news",
      "primary_domain": "apnews.com",
      "domains": [
        "apnews.com"
      ],
      "domain_count": 1,
      "categories": [
        "news_education"
      ],
      "datasets": [
        "global"
      ],
      "seed_status": "candidate_unverified"
    },
    {
      "name": "Apple",
      "slug": "apple",
      "primary_domain": "appattest.apple.com",
      "domains": [
        "appattest.apple.com",
        "apple-cloudkit.com",
        "apple-dns.net",
        "apple-livephotoskit.com",
        "apple-native-relay.apple.com",
        "apple.com",
        "axm-servicediscovery.apple.com",
        "cdn-apple.com",
        "deviceenrollment.apple.com",
        "deviceservices-external.apple.com",
        "gc.apple.com",
        "gdmf.apple.com",
        "icloud-content.com",
        "icloud.apple.com",
        "icloud.com",
        "identity.apple.com",
        "iprofiles.apple.com",
        "iwork.apple.com",
        "mask-api.icloud.com",
        "mask-h2.icloud.com",
        "mask.icloud.com",
        "mdmenrollment.apple.com",
        "metrics.icloud.com",
        "pong.icloud.com",
        "probe.icloud.com",
        "push.apple.com",
        "setup.icloud.com",
        "vpp.itunes.apple.com"
      ],
      "domain_count": 28,
      "categories": [
        "os_security"
      ],
      "datasets": [
        "global"
      ],
      "seed_status": "candidate_unverified"
    },
    {
      "name": "Apple Music",
      "slug": "apple-music",
      "primary_domain": "music.apple.com",
      "domains": [
        "music.apple.com"
      ],
      "domain_count": 1,
      "categories": [
        "music"
      ],
      "datasets": [
        "global"
      ],
      "seed_status": "candidate_unverified"
    },
    {
      "name": "Arch Linux",
      "slug": "arch-linux",
      "primary_domain": "archlinux.org",
      "domains": [
        "archlinux.org"
      ],
      "domain_count": 1,
      "categories": [
        "os_security"
      ],
      "datasets": [
        "global"
      ],
      "seed_status": "candidate_unverified"
    },
    {
      "name": "Avito",
      "slug": "avito",
      "primary_domain": "avito.ru",
      "domains": [
        "avito.ru"
      ],
      "domain_count": 1,
      "categories": [
        "finance_marketplaces",
        "marketplaces_delivery"
      ],
      "datasets": [
        "global",
        "russian"
      ],
      "seed_status": "candidate_unverified"
    },
    {
      "name": "AWS",
      "slug": "aws",
      "primary_domain": "amazonaws.com",
      "domains": [
        "amazonaws.com",
        "aws.amazon.com"
      ],
      "domain_count": 2,
      "categories": [
        "cloud_cdn"
      ],
      "datasets": [
        "global"
      ],
      "seed_status": "candidate_unverified"
    },
    {
      "name": "Baidu",
      "slug": "baidu",
      "primary_domain": "baidu.com",
      "domains": [
        "baidu.com"
      ],
      "domain_count": 1,
      "categories": [
        "search_portals"
      ],
      "datasets": [
        "global"
      ],
      "seed_status": "candidate_unverified"
    },
    {
      "name": "Bandcamp",
      "slug": "bandcamp",